[
  {
    "Id": "68526efc9ec085f701067990",
    "Name": "Pirate Lord",
    "Type": "Unit",
    "Attributes": {
      "height": "Standard"
    },
    "BasicProfileIds": [
      "68526efc9ec085f701067990"
    ],
    "DefaultFront": 1,
    "Formation": 0
  },
  {
    "Id": "68526efc9ec085f701067c6d",
    "Name": "Sorcerer Lord",
    "Type": "Unit",
    "Attributes": {
      "height": "Standard"
    },
    "BasicProfileIds": [
      "68526efc9ec085f701067c6d"
    ],
    "DefaultFront": 1,
    "Formation": 0
  },
  {
    "Id": "68526efc9ec085f7010680f1",
    "Name": "Special Characters",
    "Type": "Unit",
    "Attributes": {
      "height": "Standard"
    },
    "BasicProfileIds": [
      "68526efc9ec085f7010680f7"
    ],
    "DefaultFront": 1,
    "Formation": 0
  },
  {
    "Id": "68526f019ec085f70106895f",
    "Name": "First Mate",
    "Type": "Unit",
    "Attributes": {
      "height": "Standard"
    },
    "BasicProfileIds": [
      "68526f019ec085f70106895f"
    ],
    "DefaultFront": 1,
    "Formation": 0
  },
  {
    "Id": "68526f029ec085f701068c9f",
    "Name": "Pirate Captain",
    "Type": "Unit",
    "Attributes": {
      "height": "Standard"
    },
    "BasicProfileIds": [
      "68526f029ec085f701068c9f"
    ],
    "DefaultFront": 1,
    "Formation": 0
  },
  {
    "Id": "68526f029ec085f701068f7c",
    "Name": "Pirate Sorcerer",
    "Type": "Unit",
    "Attributes": {
      "height": "Standard"
    },
    "BasicProfileIds": [
      "68526f029ec085f701068f7c"
    ],
    "DefaultFront": 1,
    "Formation": 0
  },
  {
    "Id": "68526f029ec085f7010693b8",
    "Name": "Regiments of Renown",
    "Type": "Unit",
    "Attributes": {
      "height": "Standard"
    },
    "BasicProfileIds": [
      "68526f029ec085f7010693be"
    ],
    "DefaultFront": 1,
    "Formation": 0
  },
  {
    "Id": "68526f069ec085f7010698c0",
    "Name": "Special Characters",
    "Type": "Unit",
    "Attributes": {
      "height": "Standard"
    },
    "BasicProfileIds": [
      "68526f069ec085f7010698c6"
    ],
    "DefaultFront": 1,
    "Formation": 0
  },
  {
    "Id": "68526f0f9ec085f70106a1b8",
    "Name": "Buccaneers",
    "Type": "Unit",
    "Attributes": {
      "height": "Standard"
    },
    "BasicProfileIds": [
      "68526f0f9ec085f70106a1bb"
    ],
    "DefaultFront": 5,
    "Formation": 0
  },
  {
    "Id": "68526f109ec085f70106a347",
    "Name": "Deck Gunners",
    "Type": "Unit",
    "Attributes": {
      "height": "Standard"
    },
    "BasicProfileIds": [
      "68526f109ec085f70106a34a"
    ],
    "DefaultFront": 5,
    "Formation": 0
  },
  {
    "Id": "68526f119ec085f70106a782",
    "Name": "Harpooners",
    "Type": "Unit",
    "Attributes": {
      "height": "Standard"
    },
    "BasicProfileIds": [
      "68526f119ec085f70106a785"
    ],
    "DefaultFront": 5,
    "Formation": 0
  },
  {
    "Id": "68526f129ec085f70106a90e",
    "Name": "Pirate Crew",
    "Type": "Unit",
    "Attributes": {
      "height": "Standard"
    },
    "BasicProfileIds": [
      "68526f129ec085f70106a911"
    ],
    "DefaultFront": 5,
    "Formation": 0
  },
  {
    "Id": "68526f149ec085f70106ad5d",
    "Name": "Swabbies",
    "Type": "Unit",
    "Attributes": {
      "height": "Standard"
    },
    "BasicProfileIds": [
      "68526f149ec085f70106ad61"
    ],
    "DefaultFront": 5,
    "Formation": 0
  },
  {
    "Id": "68526f159ec085f70106b085",
    "Name": "Deck Cannon",
    "Type": "Unit",
    "Attributes": {
      "height": "Standard"
    },
    "BasicProfileIds": [
      "68526f159ec085f70106b085"
    ],
    "DefaultFront": 1,
    "Formation": 0
  },
  {
    "Id": "68526f159ec085f70106b21b",
    "Name": "Dwarf Sea Dogs",
    "Type": "Unit",
    "Attributes": {
      "height": "Standard"
    },
    "BasicProfileIds": [
      "68526f159ec085f70106b21e"
    ],
    "DefaultFront": 5,
    "Formation": 0
  },
  {
    "Id": "68526f179ec085f70106b602",
    "Name": "Grog Lubbers",
    "Type": "Unit",
    "Attributes": {
      "height": "Standard"
    },
    "BasicProfileIds": [
      "68526f179ec085f70106b605"
    ],
    "DefaultFront": 5,
    "Formation": 0
  },
  {
    "Id": "68526f199ec085f70106b917",
    "Name": "Norse Reavers",
    "Type": "Unit",
    "Attributes": {
      "height": "Standard"
    },
    "BasicProfileIds": [
      "68526f199ec085f70106b91a"
    ],
    "DefaultFront": 5,
    "Formation": 0
  },
  {
    "Id": "68526f1e9ec085f70106c0ee",
    "Name": "Orc Freebooterz",
    "Type": "Unit",
    "Attributes": {
      "height": "Standard"
    },
    "BasicProfileIds": [
      "68526f1e9ec085f70106c0f1"
    ],
    "DefaultFront": 5,
    "Formation": 0
  },
  {
    "Id": "68526f229ec085f70106c8b1",
    "Name": "Powder Monkeys",
    "Type": "Unit",
    "Attributes": {
      "height": "Standard"
    },
    "BasicProfileIds": [
      "68526f229ec085f70106c8b4"
    ],
    "DefaultFront": 5,
    "Formation": 0
  },
  {
    "Id": "68526f249ec085f70106ccd8",
    "Name": "Regiments of Renown",
    "Type": "Unit",
    "Attributes": {
      "height": "Standard"
    },
    "BasicProfileIds": [
      "68526f249ec085f70106cd10"
    ],
    "DefaultFront": 5,
    "Formation": 0
  },
  {
    "Id": "68526f479ec085f70106ee51",
    "Name": "Ship's Mates",
    "Type": "Unit",
    "Attributes": {
      "height": "Standard"
    },
    "BasicProfileIds": [
      "68526f479ec085f70106ee5b"
    ],
    "DefaultFront": 5,
    "Formation": 0
  },
  {
    "Id": "68526f499ec085f70106f2ae",
    "Name": "Sons of Stromfels",
    "Type": "Unit",
    "Attributes": {
      "height": "Standard"
    },
    "BasicProfileIds": [
      "68526f499ec085f70106f2b1"
    ],
    "DefaultFront": 3,
    "Formation": 0
  },
  {
    "Id": "68526f4a9ec085f70106f5bb",
    "Name": "Swivel Gunners",
    "Type": "Unit",
    "Attributes": {
      "height": "Standard"
    },
    "BasicProfileIds": [
      "68526f4a9ec085f70106f5be"
    ],
    "DefaultFront": 5,
    "Formation": 0
  },
  {
    "Id": "68526f4a9ec085f70106f73d",
    "Name": "Wokou Raiders",
    "Type": "Unit",
    "Attributes": {
      "height": "Standard"
    },
    "BasicProfileIds": [
      "68526f4a9ec085f70106f740"
    ],
    "DefaultFront": 5,
    "Formation": 0
  },
  {
    "Id": "68526f4e9ec085f70106ff00",
    "Name": "Dark Maidens",
    "Type": "Unit",
    "Attributes": {
      "height": "Standard"
    },
    "BasicProfileIds": [
      "68526f4e9ec085f70106ff03"
    ],
    "DefaultFront": 3,
    "Formation": 0
  },
  {
    "Id": "68526f4f9ec085f701070203",
    "Name": "Flying Galley",
    "Type": "Unit",
    "Attributes": {
      "height": "Standard"
    },
    "BasicProfileIds": [
      "68526f4f9ec085f701070203"
    ],
    "DefaultFront": 1,
    "Formation": 0
  },
  {
    "Id": "68526f4f9ec085f701070385",
    "Name": "Hell-Hammer Cannon",
    "Type": "Unit",
    "Attributes": {
      "height": "Standard"
    },
    "BasicProfileIds": [
      "68526f4f9ec085f70107038b"
    ],
    "DefaultFront": 1,
    "Formation": 0
  },
  {
    "Id": "68526f569ec085f701070a4d",
    "Name": "Regiments of Renown",
    "Type": "Unit",
    "Attributes": {
      "height": "Standard"
    },
    "BasicProfileIds": [
      "68526f569ec085f701070a8d"
    ],
    "DefaultFront": 5,
    "Formation": 0
  },
  {
    "Id": "68526f7c9ec085f701072ece",
    "Name": "Sea Giant",
    "Type": "Unit",
    "Attributes": {
      "height": "Standard"
    },
    "BasicProfileIds": [
      "68526f7c9ec085f701072ece"
    ],
    "DefaultFront": 1,
    "Formation": 0
  },
  {
    "Id": "68526f7c9ec085f701073041",
    "Name": "Sea Serpent Riders",
    "Type": "Unit",
    "Attributes": {
      "height": "Standard"
    },
    "BasicProfileIds": [
      "68526f7c9ec085f701073044"
    ],
    "DefaultFront": 3,
    "Formation": 0
  },
  {
    "Id": "68526f7e9ec085f701073422",
    "Name": "Turtigon Battle Platform",
    "Type": "Unit",
    "Attributes": {
      "height": "Standard"
    },
    "BasicProfileIds": [
      "68526f7e9ec085f701073422"
    ],
    "DefaultFront": 1,
    "Formation": 0
  }
]