[
  {
    "Id": "68357f6a790d8280c4b24070",
    "Name": "Great Khan",
    "Type": "Unit",
    "Attributes": {
    },
    "BasicProfileIds": [
      "68357f6a790d8280c4b24070"
    ],
    "DefaultFront": 1,
    "Formation": 0
  },
  {
    "Id": "68357f6a790d8280c4b240d1",
    "Name": "Khan",
    "Type": "Unit",
    "Attributes": {
    },
    "BasicProfileIds": [
      "68357f6a790d8280c4b240d1"
    ],
    "DefaultFront": 1,
    "Formation": 0
  },
  {
    "Id": "68357f6a790d8280c4b2413e",
    "Name": "Shaman",
    "Type": "Unit",
    "Attributes": {
    },
    "BasicProfileIds": [
      "68357f6a790d8280c4b2413e"
    ],
    "ExtraItems": [
      {
        "Id": "children of umi/hereditary spells",
        "Type": "Card"
      }
    ],
    "DefaultFront": 1,
    "Formation": 0
  },
  {
    "Id": "68357f6a790d8280c4b2419b",
    "Name": "Mammoth Hunter",
    "Type": "Unit",
    "Attributes": {
    },
    "BasicProfileIds": [
      "68357f6a790d8280c4b2419b"
    ],
    "DefaultFront": 1,
    "Formation": 0
  },
  {
    "Id": "68357f6a790d8280c4b2419b_tusker",
    "Name": "Mammoth Hunter on Tusker",
    "Type": "Unit",
    "Attributes": {
    },
    "BasicProfileIds": [
      "b7da4115-8155-4eb6-b11a-45aa67ffe740"
    ],
    "DefaultFront": 1,
    "Formation": 0
  },
  {
    "Id": "68357f6a790d8280c4b2419b_rock_aurochs",
    "Name": "Mammoth Hunter on Rock Aurochs",
    "Type": "Unit",
    "Attributes": {
    },
    "BasicProfileIds": [
      "9ada8cec-bbc7-496f-aebc-4c7d12055ee2"
    ],
    "DefaultFront": 1,
    "Formation": 0
  },
  {
    "Id": "a9b4e2d7f3c6b5a0d8e1f6c2a",
    "Name": "Ganzorig Ironbond",
    "Type": "Unit",
    "Attributes": {
    },
    "BasicProfileIds": [
      "e3d1f5b7a2c8d4f9a7c3e6b2d"
    ],
    "DefaultFront": 1,
    "Formation": 0
  },
  {
    "Id": "d4f8b2e6c9a1d3f7b2c5a8d1",
    "Name": "Valish, the Chefling",
    "Type": "Unit",
    "Attributes": {
    },
    "BasicProfileIds": [
      "b2d8a3f6c1e7d9b5c4a2f8e9c"
    ],
    "DefaultFront": 1,
    "Formation": 0
  },
  {
    "Id": "68357f6b790d8280c4b242f4",
    "Name": "Tribesmen",
    "Type": "Unit",
    "Attributes": {
    },
    "BasicProfileIds": [
      "68357f6b790d8280c4b242f6"
    ],
    "DefaultFront": 3,
    "Formation": 0
  },
  {
    "Id": "68357f6b790d8280c4b24330",
    "Name": "Bruisers",
    "Type": "Unit",
    "Attributes": {
    },
    "BasicProfileIds": [
      "68357f6b790d8280c4b24332"
    ],
    "DefaultFront": 3,
    "Formation": 0
  },
  {
    "Id": "68357f6b790d8280c4b24363",
    "Name": "Scraplings",
    "Type": "Unit",
    "Attributes": {
    },
    "BasicProfileIds": [
      "68357f6b790d8280c4b24365"
    ],
    "DefaultFront": 5,
    "Formation": 0
  },
  {
    "Id": "68357f6c790d8280c4b24457",
    "Name": "Sabretooth Tigers",
    "Type": "Unit",
    "Attributes": {
    },
    "BasicProfileIds": [
      "68357f6c790d8280c4b24459"
    ],
    "DefaultFront": 5,
    "Formation": 0
  },
  {
    "Id": "68357f6c790d8280c4b24449",
    "Name": "Scrapling Trappers",
    "Type": "Unit",
    "Attributes": {
    },
    "BasicProfileIds": [
      "68357f6c790d8280c4b2444b"
    ],
    "DefaultFront": 5,
    "Formation": 0
  },
  {
    "Id": "68357f6c790d8280c4b2443b",
    "Name": "Yetis",
    "Type": "Unit",
    "Attributes": {
    },
    "BasicProfileIds": [
      "68357f6c790d8280c4b2443d"
    ],
    "DefaultFront": 3,
    "Formation": 0
  },
  {
    "Id": "68357f6d790d8280c4b2445c",
    "Name": "Kin-Eater",
    "Type": "Unit",
    "Attributes": {
    },
    "BasicProfileIds": [
      "68357f6d790d8280c4b2445c"
    ],
    "DefaultFront": 1,
    "Formation": 0
  },
  {
    "Id": "68357f6c790d8280c4b243ff",
    "Name": "Tusker Cavalry",
    "Type": "Unit",
    "Attributes": {
    },
    "BasicProfileIds": [
      "68357f6c790d8280c4b24401"
    ],
    "DefaultFront": 3,
    "Formation": 0
  },
  {
    "Id": "68357f6c790d8280c4b243a5",
    "Name": "Mercenary Veterans",
    "Type": "Unit",
    "Attributes": {
    },
    "BasicProfileIds": [
      "68357f6c790d8280c4b243a7"
    ],
    "DefaultFront": 3,
    "Formation": 0
  },
  {
    "Id": "68357f6d790d8280c4b2445d",
    "Name": "Mercenary Gunners",
    "Type": "Unit",
    "Attributes": {
    },
    "BasicProfileIds": [
      "68357f6d790d8280c4b2445f"
    ],
    "DefaultFront": 3,
    "Formation": 0
  },
  {
    "Id": "68357f6d790d8280c4b244aa",
    "Name": "Bombardiers",
    "Type": "Unit",
    "Attributes": {
    },
    "BasicProfileIds": [
      "68357f6d790d8280c4b244ac"
    ],
    "DefaultFront": 3,
    "Formation": 0
  },
  {
    "Id": "68357f6d790d8280c4b244a8",
    "Name": "Thunder Cannon",
    "Type": "Unit",
    "Attributes": {
    },
    "BasicProfileIds": [
      "68357f6d790d8280c4b244a8"
    ],
    "DefaultFront": 1,
    "Formation": 0
  },
  {
    "Id": "68357f6d790d8280c4b244a9",
    "Name": "Scratapult",
    "Type": "Unit",
    "Attributes": {
    },
    "BasicProfileIds": [
      "68357f6d790d8280c4b244a9"
    ],
    "DefaultFront": 1,
    "Formation": 0
  },
  {
    "Id": "68357f6d790d8280c4b244dd",
    "Name": "Rock Aurochs",
    "Type": "Unit",
    "Attributes": {
    },
    "BasicProfileIds": [
      "68357f6d790d8280c4b244dd"
    ],
    "DefaultFront": 1,
    "Formation": 0
  },
  {
    "Id": "68357f6e790d8280c4b244e2",
    "Name": "Frost Mammoth",
    "Type": "Unit",
    "Attributes": {
    },
    "BasicProfileIds": [
      "68357f6e790d8280c4b244e2"
    ],
    "DefaultFront": 1,
    "Formation": 0
  },
  {
    "Id": "68357f6e790d8280c4b244e6",
    "Name": "Mercenary Giant",
    "Type": "Unit",
    "Attributes": {
    },
    "BasicProfileIds": [
      "68357f6e790d8280c4b244e6"
    ],
    "DefaultFront": 1,
    "Formation": 0
  }
]