[
  {
    "Id": "68357f25790d8280c4b1e20c",
    "Name": "Wildhorn Lord",
    "Type": "Unit",
    "Attributes": {
    },
    "BasicProfileIds": [
      "68357f25790d8280c4b1e20c"
    ],
    "DefaultFront": 1,
    "Formation": 0
  },
  {
    "Id": "68357f25790d8280c4b1e20c_raiding_chariot",
    "Name": "Wildhorn Lord on Raiding Chariot",
    "Type": "Unit",
    "Attributes": {
    },
    "BasicProfileIds": [
      "a2600f11-2540-44f6-ad33-2acbc6e213aa"
    ],
    "DefaultFront": 1,
    "Formation": 0
  },
  {
    "Id": "68357f25790d8280c4b1e20c_razortusk_chariot",
    "Name": "Wildhorn Lord on Razortusk Chariot",
    "Type": "Unit",
    "Attributes": {
    },
    "BasicProfileIds": [
      "d0efe3cd-1302-415c-b002-08a98574ed70"
    ],
    "DefaultFront": 1,
    "Formation": 0
  },
  {
    "Id": "68357f25790d8280c4b1e32c",
    "Name": "Wildhorn Chieftain",
    "Type": "Unit",
    "Attributes": {
    },
    "BasicProfileIds": [
      "68357f25790d8280c4b1e32c"
    ],
    "DefaultFront": 1,
    "Formation": 0
  },
  {
    "Id": "68357f25790d8280c4b1e32c_raiding_chariot",
    "Name": "Wildhorn Chieftain on Raiding Chariot",
    "Type": "Unit",
    "Attributes": {
    },
    "BasicProfileIds": [
      "08f722f6-aea9-43bf-b995-7fde6dc0e6ae"
    ],
    "DefaultFront": 1,
    "Formation": 0
  },
  {
    "Id": "68357f26790d8280c4b1e403",
    "Name": "Soothsayer",
    "Type": "Unit",
    "Attributes": {
    },
    "BasicProfileIds": [
      "68357f26790d8280c4b1e403"
    ],
    "ExtraItems": [
      {
        "Id": "echoes of the dark forest/hereditary spells",
        "Type": "Card"
      }
    ],
    "DefaultFront": 1,
    "Formation": 0
  },
  {
    "Id": "68357f26790d8280c4b1e403_raiding_chariot",
    "Name": "Soothsayer on Raiding Chariot",
    "Type": "Unit",
    "Attributes": {
    },
    "BasicProfileIds": [
      "035dfa56-3979-4ae1-a0b4-07f4dc3f0607"
    ],
    "ExtraItems": [
      {
        "Id": "echoes of the dark forest/hereditary spells",
        "Type": "Card"
      }
    ],
    "DefaultFront": 1,
    "Formation": 0
  },
  {
    "Id": "68357f26790d8280c4b1e535",
    "Name": "Centaur Chieftain",
    "Type": "Unit",
    "Attributes": {
    },
    "BasicProfileIds": [
      "68357f26790d8280c4b1e535"
    ],
    "DefaultFront": 1,
    "Formation": 0
  },
  {
    "Id": "68357f26790d8280c4b1e492",
    "Name": "Minotaur Warlord",
    "Type": "Unit",
    "Attributes": {
    },
    "BasicProfileIds": [
      "68357f26790d8280c4b1e492"
    ],
    "DefaultFront": 1,
    "Formation": 0
  },
  {
    "Id": "68357f26790d8280c4b1e4dd",
    "Name": "Minotaur Chieftain",
    "Type": "Unit",
    "Attributes": {
    },
    "BasicProfileIds": [
      "68357f26790d8280c4b1e4dd"
    ],
    "DefaultFront": 1,
    "Formation": 0
  },
  {
    "Id": "f7d2b4e0a3c9d5f3e8c1a4b9d",
    "Name": "Mooarrgh, The Perpetuator of Heroes",
    "Type": "Unit",
    "Attributes": {
    },
    "BasicProfileIds": [
      "b1d4e8a9237c5f2a9d8b1c3d4"
    ],
    "DefaultFront": 1,
    "Formation": 0
  },
  {
    "Id": "t1x4y2u6v7w5q3m9r0p8s4b",
    "Name": "Ghaa!, THE Quiet Muzzle",
    "Type": "Unit",
    "Attributes": {
    },
    "BasicProfileIds": [
      "a7d8f9b2c4a1e3f9d6c8b0e5"
    ],
    "DefaultFront": 1,
    "Formation": 0
  },
  {
    "Id": "68357f26790d8280c4b1e595",
    "Name": "Wildhorn Herd",
    "Type": "Unit",
    "Attributes": {
    },
    "BasicProfileIds": [
      "68357f26790d8280c4b1e597"
    ],
    "DefaultFront": 5,
    "Formation": 0
  },
  {
    "Id": "68357f26790d8280c4b1e5e9",
    "Name": "Mongrel Herd",
    "Type": "Unit",
    "Attributes": {
    },
    "BasicProfileIds": [
      "68357f26790d8280c4b1e5eb"
    ],
    "DefaultFront": 5,
    "Formation": 0
  },
  {
    "Id": "68357f27790d8280c4b1e625",
    "Name": "Mongrel Raiders",
    "Type": "Unit",
    "Attributes": {
    },
    "BasicProfileIds": [
      "68357f27790d8280c4b1e627"
    ],
    "DefaultFront": 5,
    "Formation": 0
  },
  {
    "Id": "68357f27790d8280c4b1e637",
    "Name": "Feral Hounds",
    "Type": "Unit",
    "Attributes": {
    },
    "BasicProfileIds": [
      "68357f27790d8280c4b1e639"
    ],
    "DefaultFront": 5,
    "Formation": 0
  },
  {
    "Id": "68357f27790d8280c4b1e63c",
    "Name": "Longhorn Herd",
    "Type": "Unit",
    "Attributes": {
    },
    "BasicProfileIds": [
      "68357f27790d8280c4b1e63e"
    ],
    "DefaultFront": 5,
    "Formation": 0
  },
  {
    "Id": "68357f27790d8280c4b1e68a",
    "Name": "Minotaurs",
    "Type": "Unit",
    "Attributes": {
    },
    "BasicProfileIds": [
      "68357f27790d8280c4b1e68c"
    ],
    "DefaultFront": 3,
    "Formation": 0
  },
  {
    "Id": "68357f27790d8280c4b1e6d5",
    "Name": "Centaurs",
    "Type": "Unit",
    "Attributes": {
    },
    "BasicProfileIds": [
      "68357f27790d8280c4b1e6d7"
    ],
    "DefaultFront": 5,
    "Formation": 0
  },
  {
    "Id": "68357f28790d8280c4b1e72c",
    "Name": "Raiding Chariots",
    "Type": "Unit",
    "Attributes": {
    },
    "BasicProfileIds": [
      "68357f28790d8280c4b1e72e"
    ],
    "DefaultFront": 1,
    "Formation": 0
  },
  {
    "Id": "68357f28790d8280c4b1e731",
    "Name": "Razortusk Herd",
    "Type": "Unit",
    "Attributes": {
    },
    "BasicProfileIds": [
      "68357f28790d8280c4b1e733"
    ],
    "DefaultFront": 3,
    "Formation": 0
  },
  {
    "Id": "68357f28790d8280c4b1e736",
    "Name": "Razortusk Chariot",
    "Type": "Unit",
    "Attributes": {
    },
    "BasicProfileIds": [
      "68357f28790d8280c4b1e736"
    ],
    "DefaultFront": 1,
    "Formation": 0
  },
  {
    "Id": "68357f28790d8280c4b1e737",
    "Name": "Briar Beast",
    "Type": "Unit",
    "Attributes": {
    },
    "BasicProfileIds": [
      "68357f28790d8280c4b1e737"
    ],
    "DefaultFront": 1,
    "Formation": 0
  },
  {
    "Id": "68357f28790d8280c4b1e738",
    "Name": "Gargoyles",
    "Type": "Unit",
    "Attributes": {
    },
    "BasicProfileIds": [
      "68357f28790d8280c4b1e73a"
    ],
    "DefaultFront": 5,
    "Formation": 0
  },
  {
    "Id": "68357f28790d8280c4b1e73d",
    "Name": "Cyclops",
    "Type": "Unit",
    "Attributes": {
    },
    "BasicProfileIds": [
      "68357f28790d8280c4b1e73d"
    ],
    "DefaultFront": 1,
    "Formation": 0
  },
  {
    "Id": "68357f28790d8280c4b1e73e",
    "Name": "Gortach",
    "Type": "Unit",
    "Attributes": {
    },
    "BasicProfileIds": [
      "68357f28790d8280c4b1e73e"
    ],
    "DefaultFront": 1,
    "Formation": 0
  },
  {
    "Id": "68357f28790d8280c4b1e73f",
    "Name": "Jabberwock",
    "Type": "Unit",
    "Attributes": {
    },
    "BasicProfileIds": [
      "68357f28790d8280c4b1e73f"
    ],
    "DefaultFront": 1,
    "Formation": 0
  },
  {
    "Id": "68357f29790d8280c4b1e740",
    "Name": "Beast Giant",
    "Type": "Unit",
    "Attributes": {
    },
    "BasicProfileIds": [
      "68357f29790d8280c4b1e740"
    ],
    "DefaultFront": 1,
    "Formation": 0
  },
  {
    "Id": "68357f29790d8280c4b1e74f",
    "Name": "Totemic Beast",
    "Type": "Unit",
    "Attributes": {
    },
    "BasicProfileIds": [
      "68357f29790d8280c4b1e74f"
    ],
    "DefaultFront": 1,
    "Formation": 0
  }
]