[
  {
    "Id": "685274309ec085f7011400cb",
    "Name": "Special Characters",
    "Type": "Unit",
    "Attributes": {
      "height": "Standard"
    },
    "BasicProfileIds": [
      "685274309ec085f7011400d1"
    ],
    "DefaultFront": 1,
    "Formation": 0
  },
  {
    "Id": "685274309ec085f7011400cb_necrofex_colossus",
    "Name": "Special Characters on Necrofex Colossus",
    "Type": "Unit",
    "Attributes": {
      "height": "Standard"
    },
    "BasicProfileIds": [
      "4c7f02d3-444b-4e27-8bcd-36929a95b63e"
    ],
    "DefaultFront": 1,
    "Formation": 0
  },
  {
    "Id": "685274369ec085f70114082c",
    "Name": "Vampire Fleet Admiral",
    "Type": "Unit",
    "Attributes": {
      "height": "Standard"
    },
    "BasicProfileIds": [
      "685274369ec085f70114082c"
    ],
    "DefaultFront": 1,
    "Formation": 0
  },
  {
    "Id": "685274389ec085f701140d11",
    "Name": "Gunnery Wight",
    "Type": "Unit",
    "Attributes": {
      "height": "Standard"
    },
    "BasicProfileIds": [
      "685274389ec085f701140d11"
    ],
    "DefaultFront": 1,
    "Formation": 0
  },
  {
    "Id": "685274399ec085f701141037",
    "Name": "Special Characters",
    "Type": "Unit",
    "Attributes": {
      "height": "Standard"
    },
    "BasicProfileIds": [
      "685274399ec085f70114103d"
    ],
    "DefaultFront": 1,
    "Formation": 0
  },
  {
    "Id": "685274439ec085f701141696",
    "Name": "Vampire Fleet Captain",
    "Type": "Unit",
    "Attributes": {
      "height": "Standard"
    },
    "BasicProfileIds": [
      "685274439ec085f701141696"
    ],
    "DefaultFront": 1,
    "Formation": 0
  },
  {
    "Id": "685274459ec085f701141acf",
    "Name": "Bloated Corpse",
    "Type": "Unit",
    "Attributes": {
      "height": "Standard"
    },
    "BasicProfileIds": [
      "685274459ec085f701141acf"
    ],
    "DefaultFront": 1,
    "Formation": 0
  },
  {
    "Id": "685274459ec085f701141c38",
    "Name": "Razortooth Rats",
    "Type": "Unit",
    "Attributes": {
      "height": "Standard"
    },
    "BasicProfileIds": [
      "685274459ec085f701141c3c"
    ],
    "DefaultFront": 5,
    "Formation": 0
  },
  {
    "Id": "685274459ec085f701141da6",
    "Name": "Scurvy Dogs",
    "Type": "Unit",
    "Attributes": {
      "height": "Standard"
    },
    "BasicProfileIds": [
      "685274459ec085f701141daa"
    ],
    "DefaultFront": 5,
    "Formation": 0
  },
  {
    "Id": "685274469ec085f70114208b",
    "Name": "Verminous Crew",
    "Type": "Unit",
    "Attributes": {
      "height": "Standard"
    },
    "BasicProfileIds": [
      "685274469ec085f70114208b"
    ],
    "DefaultFront": 1,
    "Formation": 0
  },
  {
    "Id": "685274469ec085f7011421f7",
    "Name": "Zombie Pirate Deckhands",
    "Type": "Unit",
    "Attributes": {
      "height": "Standard"
    },
    "BasicProfileIds": [
      "685274469ec085f7011421fa"
    ],
    "DefaultFront": 5,
    "Formation": 0
  },
  {
    "Id": "6852744b9ec085f701142661",
    "Name": "Zombie Pirate Gunners",
    "Type": "Unit",
    "Attributes": {
      "height": "Standard"
    },
    "BasicProfileIds": [
      "6852744b9ec085f701142664"
    ],
    "DefaultFront": 5,
    "Formation": 0
  },
  {
    "Id": "685274519ec085f701142add",
    "Name": "Animated Hulks",
    "Type": "Unit",
    "Attributes": {
      "height": "Standard"
    },
    "BasicProfileIds": [
      "685274519ec085f701142ae0"
    ],
    "DefaultFront": 3,
    "Formation": 0
  },
  {
    "Id": "685274529ec085f701142c40",
    "Name": "Carronade",
    "Type": "Unit",
    "Attributes": {
      "height": "Standard"
    },
    "BasicProfileIds": [
      "685274529ec085f701142c40"
    ],
    "DefaultFront": 1,
    "Formation": 0
  },
  {
    "Id": "685274529ec085f701142da9",
    "Name": "Damned Crew",
    "Type": "Unit",
    "Attributes": {
      "height": "Standard"
    },
    "BasicProfileIds": [
      "685274529ec085f701142da9"
    ],
    "DefaultFront": 1,
    "Formation": 0
  },
  {
    "Id": "685274529ec085f701142f16",
    "Name": "Deck Droppers",
    "Type": "Unit",
    "Attributes": {
      "height": "Standard"
    },
    "BasicProfileIds": [
      "685274529ec085f701142f19"
    ],
    "DefaultFront": 3,
    "Formation": 0
  },
  {
    "Id": "685274529ec085f701143090",
    "Name": "Deck Gunners",
    "Type": "Unit",
    "Attributes": {
      "height": "Standard"
    },
    "BasicProfileIds": [
      "685274529ec085f701143093"
    ],
    "DefaultFront": 5,
    "Formation": 0
  },
  {
    "Id": "685274529ec085f701143203",
    "Name": "Depth Guard",
    "Type": "Unit",
    "Attributes": {
      "height": "Standard"
    },
    "BasicProfileIds": [
      "685274529ec085f701143207"
    ],
    "DefaultFront": 5,
    "Formation": 0
  },
  {
    "Id": "685274589ec085f7011439b2",
    "Name": "Mortar",
    "Type": "Unit",
    "Attributes": {
      "height": "Standard"
    },
    "BasicProfileIds": [
      "685274589ec085f7011439b2"
    ],
    "DefaultFront": 1,
    "Formation": 0
  },
  {
    "Id": "685274589ec085f701143b1b",
    "Name": "Regiments of Renown",
    "Type": "Unit",
    "Attributes": {
      "height": "Standard"
    },
    "BasicProfileIds": [
      "685274589ec085f701143b4f"
    ],
    "DefaultFront": 5,
    "Formation": 0
  },
  {
    "Id": "685274799ec085f70114591a",
    "Name": "Rotting Prometheans",
    "Type": "Unit",
    "Attributes": {
      "height": "Standard"
    },
    "BasicProfileIds": [
      "685274799ec085f70114591d"
    ],
    "DefaultFront": 3,
    "Formation": 0
  },
  {
    "Id": "6852747b9ec085f701145a8e",
    "Name": "Bone Hydra",
    "Type": "Unit",
    "Attributes": {
      "height": "Standard"
    },
    "BasicProfileIds": [
      "6852747b9ec085f701145a8e"
    ],
    "DefaultFront": 1,
    "Formation": 0
  },
  {
    "Id": "6852747b9ec085f701145bed",
    "Name": "Depth Guard",
    "Type": "Unit",
    "Attributes": {
      "height": "Standard"
    },
    "BasicProfileIds": [
      "685274529ec085f701143207"
    ],
    "DefaultFront": 5,
    "Formation": 0
  },
  {
    "Id": "685274819ec085f701146360",
    "Name": "Necrofex Colossus",
    "Type": "Unit",
    "Attributes": {
      "height": "Standard"
    },
    "BasicProfileIds": [
      "685274819ec085f701146360"
    ],
    "DefaultFront": 1,
    "Formation": 0
  },
  {
    "Id": "685274819ec085f7011464bf",
    "Name": "Queen Bess",
    "Type": "Unit",
    "Attributes": {
      "height": "Standard"
    },
    "BasicProfileIds": [
      "685274819ec085f7011464bf"
    ],
    "DefaultFront": 1,
    "Formation": 0
  },
  {
    "Id": "685274819ec085f701146629",
    "Name": "Regiments of Renown",
    "Type": "Unit",
    "Attributes": {
      "height": "Standard"
    },
    "BasicProfileIds": [
      "685274819ec085f701146653"
    ],
    "DefaultFront": 5,
    "Formation": 0
  },
  {
    "Id": "685274a09ec085f701147b9a",
    "Name": "Rotting Leviathan",
    "Type": "Unit",
    "Attributes": {
      "height": "Standard"
    },
    "BasicProfileIds": [
      "685274a09ec085f701147b9a"
    ],
    "DefaultFront": 1,
    "Formation": 0
  },
  {
    "Id": "685274a09ec085f701147d08",
    "Name": "Syreen",
    "Type": "Unit",
    "Attributes": {
      "height": "Standard"
    },
    "BasicProfileIds": [
      "685274a09ec085f701147d08"
    ],
    "DefaultFront": 1,
    "Formation": 0
  }
]