[
  {
    "Id": "unit_1762430184726",
    "Name": "Kapricus Defenders",
    "Type": "Unit",
    "Attributes": {
      "Keywords": "VEHICLE, FLY, HERNKYN, KAPRICUS, DEFENDERS"
    },
    "BasicProfileIds": [
      "profile_1765531819808"
    ],
    "DefaultFront": 1,
    "Formation": 3
  },
  {
    "Id": "unit_1762429898661",
    "Name": "Ironkin Steeljacks with Melee Weapons",
    "Type": "Unit",
    "Attributes": {
      "Keywords": "INFANTRY, IRONKIN STEELJACKS, IRONKIN STEELJACKS WITH MELEE WEAPONS"
    },
    "BasicProfileIds": [
      "profile_1762429958534"
    ],
    "DefaultFront": 3,
    "Formation": 3
  },
  {
    "Id": "unit_1762429485874",
    "Name": "Ironkin Steeljacks with Heavy Volkanite Disintegrators",
    "Type": "Unit",
    "Attributes": {
      "Keywords": "INFANTRY, IRONKIN STEELJACKS, IRONKIN STEELJACKS WITH HEAVY VOLKANITE DISINTEGRATORS"
    },
    "BasicProfileIds": [
      "profile_1762429371058"
    ],
    "DefaultFront": 3,
    "Formation": 3
  },
  {
    "Id": "unit_1762428245556",
    "Name": "Cthonian Earthshakers",
    "Type": "Unit",
    "Attributes": {
      "Keywords": "INFANTRY, ARTILLERY, CTHONIAN, EARTHSHAKERS"
    },
    "BasicProfileIds": [
      "profile_1765530787724"
    ],
    "DefaultFront": 2,
    "Formation": 3
  },
  {
    "Id": "unit_1762426807142",
    "Name": "Kapricus Carrier",
    "Type": "Unit",
    "Attributes": {
      "Keywords": "VEHICLE, FLY, TRANSPORT, DEDICATED TRANSPORT,  HERNKYN, KAPRICUS, CARRIER"
    },
    "BasicProfileIds": [
      "profile_1762426536676"
    ],
    "DefaultFront": 1,
    "Formation": 3
  },
  {
    "Id": "unit_1762423242581",
    "Name": "Memnyr Strategist",
    "Type": "Unit",
    "Attributes": {
      "Keywords": "INFANTRY, CHARACTER, MEMNYR STRATEGIST"
    },
    "BasicProfileIds": [
      "profile_1765531236892"
    ],
    "DefaultFront": 1,
    "Formation": 3
  },
  {
    "Id": "unit_1762422562746",
    "Name": "Buri Aegnirssen",
    "Type": "Unit",
    "Attributes": {
      "Keywords": "INFANTRY, CHARACTER, EPIC HERO, Buri Aegnirssen"
    },
    "BasicProfileIds": [
      "profile_1762422568289"
    ],
    "DefaultFront": 1,
    "Formation": 3
  },
  {
    "Id": "unit_1762421120299",
    "Name": "Arkanyst Evaluator",
    "Type": "Unit",
    "Attributes": {
      "Keywords": "INFANTRY, CHARACTER, Arkanyst Evaluator"
    },
    "BasicProfileIds": [
      "profile_1762421178892"
    ],
    "DefaultFront": 1,
    "Formation": 3
  },
  {
    "Id": "unit_2e6e-95a1-60ad-7b1c",
    "Name": "Ûthar the Destined",
    "Type": "Unit",
    "Attributes": {
      "Keywords": "INFANTRY, CHARACTER, EPIC HERO, ÛTHAR THE DESTINED",
      "Faction Keywords": "LEAGUES OF VOTANN"
    },
    "BasicProfileIds": [
      "profile_62d7-f00c-5f67-b8cc"
    ],
    "DefaultFront": 1,
    "Formation": 3
  },
  {
    "Id": "unit_ba4f-c3f9-6925-af0c",
    "Name": "Hearthkyn Warriors",
    "Type": "Unit",
    "Attributes": {
      "Keywords": "INFANTRY, BATTLELINE, GRENADES, HEARTHKYN WARRIORS",
      "Faction Keywords": "LEAGUES OF VOTANN"
    },
    "BasicProfileIds": [
      "profile_15e9-df12-30b7-42cb"
    ],
    "DefaultFront": 10,
    "Formation": 3
  },
  {
    "Id": "unit_1b00-2abb-718f-def6",
    "Name": "Kâhl",
    "Type": "Unit",
    "Attributes": {
      "Keywords": "INFANTRY, CHARACTER, KÂHL",
      "Faction Keywords": "LEAGUES OF VOTANN"
    },
    "BasicProfileIds": [
      "profile_2e4d-3b38-ed87-7de2"
    ],
    "DefaultFront": 1,
    "Formation": 3
  },
  {
    "Id": "unit_2cc6-e2bf-635f-1260",
    "Name": "Einhyr Champion",
    "Type": "Unit",
    "Attributes": {
      "Keywords": "INFANTRY, CHARACTER, EXO-ARMOUR, EINHYR CHAMPION",
      "Faction Keywords": "LEAGUES OF VOTANN"
    },
    "BasicProfileIds": [
      "profile_d084-0450-7a53-d656"
    ],
    "DefaultFront": 1,
    "Formation": 3
  },
  {
    "Id": "unit_d3a3-2d20-bd7e-6778",
    "Name": "Grimnyr",
    "Type": "Unit",
    "Attributes": {
      "Keywords": "INFANTRY, CHARACTER, PSYKER, GRIMNYR",
      "Faction Keywords": "LEAGUES OF VOTANN"
    },
    "BasicProfileIds": [
      "profile_ef46-8dd2-8877-2b9a"
    ],
    "DefaultFront": 1,
    "Formation": 3
  },
  {
    "Id": "unit_8f33-5601-3707-78f4",
    "Name": "Brôkhyr Iron-master",
    "Type": "Unit",
    "Attributes": {
      "Keywords": "INFANTRY, CHARACTER, BRÔKHYR IRON-MASTER",
      "Faction Keywords": "LEAGUES OF VOTANN"
    },
    "BasicProfileIds": [
      "profile_2f7e-4566-c55b-9a8c"
    ],
    "DefaultFront": 1,
    "Formation": 3
  },
  {
    "Id": "unit_09d3-6357-7888-00d9",
    "Name": "Einhyr Hearthguard",
    "Type": "Unit",
    "Attributes": {
      "Keywords": "INFANTRY, EXO-ARMOUR, EINHYR HEARTHGUARD",
      "Faction Keywords": "LEAGUES OF VOTANN"
    },
    "BasicProfileIds": [
      "profile_6d55-c9c5-a65e-62ed"
    ],
    "DefaultFront": 5,
    "Formation": 3
  },
  {
    "Id": "unit_415a-e6f6-d17f-d700",
    "Name": "Cthonian Beserks",
    "Type": "Unit",
    "Attributes": {
      "Keywords": "INFANTRY, CTHONIAN BESERKS",
      "Faction Keywords": "LEAGUES OF VOTANN"
    },
    "BasicProfileIds": [
      "profile_7b48-5717-37e7-66ae"
    ],
    "DefaultFront": 5,
    "Formation": 3
  },
  {
    "Id": "unit_9086-5272-398b-bbce",
    "Name": "Hernkyn Pioneers",
    "Type": "Unit",
    "Attributes": {
      "Keywords": "MOUNTED, GRENADES, FLY, HERNKYN PIONEERS",
      "Faction Keywords": "LEAGUES OF VOTANN"
    },
    "BasicProfileIds": [
      "profile_eed4-0f4c-f180-db12"
    ],
    "DefaultFront": 3,
    "Formation": 3
  },
  {
    "Id": "unit_9655-8367-7467-9e6e",
    "Name": "Sagitaur",
    "Type": "Unit",
    "Attributes": {
      "Keywords": "VEHICLE, TRANSPORT, DEDICATED TRANSPORT, SAGITAUR",
      "Faction Keywords": "LEAGUES OF VOTANN"
    },
    "BasicProfileIds": [
      "profile_fde8-be9f-0fa6-4591"
    ],
    "DefaultFront": 1,
    "Formation": 3
  },
  {
    "Id": "unit_ea1b-99f6-c398-06b1",
    "Name": "Brôkhyr Thunderkyn",
    "Type": "Unit",
    "Attributes": {
      "Keywords": "INFANTRY, EXO-FRAME, BRÔKHYR THUNDERKYN",
      "Faction Keywords": "LEAGUES OF VOTANN"
    },
    "BasicProfileIds": [
      "profile_2c5b-6e8a-304c-6c85"
    ],
    "DefaultFront": 3,
    "Formation": 3
  },
  {
    "Id": "unit_a110-e538-4e85-159b",
    "Name": "Hekaton Land Fortress",
    "Type": "Unit",
    "Attributes": {
      "Keywords": "VEHICLE, TRANSPORT, HEKATON LAND FORTRESS",
      "Faction Keywords": "LEAGUES OF VOTANN"
    },
    "BasicProfileIds": [
      "profile_3d20-658f-d5de-a094"
    ],
    "DefaultFront": 1,
    "Formation": 3
  },
  {
    "Id": "unit_5b0b-c18d-1470-44bb",
    "Name": "Hernkyn Yaegirs",
    "Type": "Unit",
    "Attributes": {
      "Keywords": "INFANTRY, GRENADES, HERNKYN YAEGIRS",
      "Faction Keywords": "LEAGUES OF VOTANN"
    },
    "BasicProfileIds": [
      "profile_3cb7-824f-70fc-ac53"
    ],
    "DefaultFront": 10,
    "Formation": 3
  },
  {
    "Id": "units_1772526679671",
    "Name": "Berehk Stornbröw",
    "Type": "Unit",
    "DefaultFront": 1,
    "Formation": 3,
    "BasicProfileIds": [
      "profiles_1772526628484"
    ],
    "Attributes": {
      "KEYWORDS": "INFANTRY, CHARACTER, EPIC HERO, CTHONIAN, BEREHK STORNBRÖW",
      "FACTION KEYWORDS": "LEAGUES OF VOTANN"
    }
  }
]