[
  {
    "Id": "unit_1762772792664",
    "Name": "Acolyte Hybrids With Hand Flamers",
    "Type": "Unit",
    "Attributes": {
      "Keywords": "INFANTRY, BATTLELINE, GRENADES, GREAT DEVOURER, ACOLYTE HYBRIDS, ACOLYTE HYBRIDS WITH HAND FLAMERS"
    },
    "BasicProfileIds": [
      "profile_1762772804938",
      "profiles_1773327370374"
    ],
    "DefaultFront": 5,
    "Formation": 3
  },
  {
    "Id": "unit_1762772675780",
    "Name": "Acolyte Hybrids With Autopistols",
    "Type": "Unit",
    "Attributes": {
      "Keywords": "INFANTRY, BATTLELINE, GRENADES, GREAT DEVOURER, ACOLYTE HYBRIDS, ACOLYTE HYBRIDS WITH AUTOPISTOLS"
    },
    "BasicProfileIds": [
      "profile_1762772538438",
      "profiles_1773327072648"
    ],
    "DefaultFront": 5,
    "Formation": 3
  },
  {
    "Id": "unit_f51d-bc51-f301-9dee",
    "Name": "Aberrants",
    "Type": "Unit",
    "Attributes": {
      "Keywords": "ABERRANTS, INFANTRY, GREAT DEVOURER",
      "Faction Keywords": "GENESTEALER CULTS"
    },
    "BasicProfileIds": [
      "profile_1db4-b61a-1deb-ec1b",
      "profiles_1773329030125"
    ],
    "DefaultFront": 5,
    "Formation": 3
  },
  {
    "Id": "unit_97b1-4873-9fcb-5cb8",
    "Name": "Abominant",
    "Type": "Unit",
    "Attributes": {
      "Keywords": "ABOMINANT, INFANTRY, CHARACTER, GREAT DEVOURER",
      "Faction Keywords": "GENESTEALER CULTS"
    },
    "BasicProfileIds": [
      "profile_bacf-60a3-1a2e-7ab6"
    ],
    "DefaultFront": 1,
    "Formation": 3
  },
  {
    "Id": "unit_cf71-a12a-2730-c40b",
    "Name": "Achilles Ridgerunners",
    "Type": "Unit",
    "Attributes": {
      "Keywords": "ACHILLES RIDGERUNNERS, VEHICLE, GREAT DEVOURER",
      "Faction Keywords": "GENESTEALER CULTS"
    },
    "BasicProfileIds": [
      "profile_cc13-c299-d35c-cdd7"
    ],
    "DefaultFront": 1,
    "Formation": 3
  },
  {
    "Id": "unit_e367-b2cb-d22a-b17c",
    "Name": "Acolyte Iconward",
    "Type": "Unit",
    "Attributes": {
      "Keywords": "ACOLYTE ICONWARD, INFANTRY, CHARACTER, GRENADES, GREAT DEVOURER",
      "Faction Keywords": "GENESTEALER CULTS"
    },
    "BasicProfileIds": [
      "profile_1625-20a0-5afd-d9fe"
    ],
    "DefaultFront": 1,
    "Formation": 3
  },
  {
    "Id": "unit_3a81-2b84-bf4c-4f85",
    "Name": "Atalan Jackals",
    "Type": "Unit",
    "Attributes": {
      "Keywords": "ATALAN JACKALS, MOUNTED, GRENADES, GREAT DEVOURER",
      "Faction Keywords": "GENESTEALER CULTS"
    },
    "BasicProfileIds": [
      "profile_df5f-99f2-c2c7-fae1",
      "profiles_1773329506920"
    ],
    "DefaultFront": 5,
    "Formation": 3
  },
  {
    "Id": "unit_725f-8a41-dc78-52f5",
    "Name": "Biophagus",
    "Type": "Unit",
    "Attributes": {
      "Keywords": "BIOPHAGUS, INFANTRY, CHARACTER, GREAT DEVOURER",
      "Faction Keywords": "GENESTEALER CULTS"
    },
    "BasicProfileIds": [
      "profile_e890-54be-98e8-8b60"
    ],
    "DefaultFront": 1,
    "Formation": 3
  },
  {
    "Id": "unit_5543-973a-cd2e-c941",
    "Name": "Clamavus",
    "Type": "Unit",
    "Attributes": {
      "Keywords": "CLAMAVUS, INFANTRY, CHARACTER, GREAT DEVOURER",
      "Faction Keywords": "GENESTEALER CULTS"
    },
    "BasicProfileIds": [
      "profile_7f74-bf54-fc5c-8ba7"
    ],
    "DefaultFront": 1,
    "Formation": 3
  },
  {
    "Id": "unit_5ac1-3adb-212a-5e02",
    "Name": "Goliath Rockgrinder",
    "Type": "Unit",
    "Attributes": {
      "Keywords": "GOLIATH ROCKGRINDER, VEHICLE, GREAT DEVOURER, TRANSPORT",
      "Faction Keywords": "GENESTEALER CULTS"
    },
    "BasicProfileIds": [
      "profile_9a75-6059-57b1-1d40"
    ],
    "DefaultFront": 1,
    "Formation": 3
  },
  {
    "Id": "unit_1d1-f0d2-b810-12fe",
    "Name": "Goliath Truck",
    "Type": "Unit",
    "Attributes": {
      "Keywords": "GOLIATH TRUCK, VEHICLE, DEDICATED TRANSPORT, TRANSPORT, GREAT DEVOURER",
      "Faction Keywords": "GENESTEALER CULTS"
    },
    "BasicProfileIds": [
      "profile_33d1-3163-d41d-8f0e"
    ],
    "DefaultFront": 1,
    "Formation": 3
  },
  {
    "Id": "unit_8a84-a8fd-977e-9118",
    "Name": "Hybrid Metamorphs",
    "Type": "Unit",
    "Attributes": {
      "Keywords": "HYBRID METAMORPHS, INFANTRY, GRENADES, GREAT DEVOURER",
      "Faction Keywords": "GENESTEALER CULTS"
    },
    "BasicProfileIds": [
      "profile_63cc-4b91-d1de-fea7",
      "profiles_1773392139358"
    ],
    "DefaultFront": 5,
    "Formation": 3
  },
  {
    "Id": "unit_6426-ca59-402a-d399",
    "Name": "Jackal Alphus",
    "Type": "Unit",
    "Attributes": {
      "Keywords": "JACKAL ALPHUS, CHARACTER, GRENADES, GREAT DEVOURER, MOUNTED",
      "Faction Keywords": "GENESTEALER CULTS"
    },
    "BasicProfileIds": [
      "profile_a971-972a-f572-7f7"
    ],
    "DefaultFront": 1,
    "Formation": 3
  },
  {
    "Id": "unit_5e0e-11d9-181d-3481",
    "Name": "Kelermorph",
    "Type": "Unit",
    "Attributes": {
      "Keywords": "KELERMORPH, INFANTRY, CHARACTER, GREAT DEVOURER",
      "Faction Keywords": "GENESTEALER CULTS"
    },
    "BasicProfileIds": [
      "profile_9a93-51fd-a789-b0c"
    ],
    "DefaultFront": 1,
    "Formation": 3
  },
  {
    "Id": "unit_51e8-dac1-561a-aaa9",
    "Name": "Locus",
    "Type": "Unit",
    "Attributes": {
      "Keywords": "LOCUS, INFANTRY, CHARACTER, GREAT DEVOURER",
      "Faction Keywords": "GENESTEALER CULTS"
    },
    "BasicProfileIds": [
      "profile_b2fa-47b8-5df8-7d0a"
    ],
    "DefaultFront": 1,
    "Formation": 3
  },
  {
    "Id": "unit_4f4-2157-2cb5-8bb",
    "Name": "Magus",
    "Type": "Unit",
    "Attributes": {
      "Keywords": "MAGUS, INFANTRY, CHARACTER, PSYKER, GREAT DEVOURER",
      "Faction Keywords": "GENESTEALER CULTS"
    },
    "BasicProfileIds": [
      "profile_275f-3264-3ec9-8c56"
    ],
    "DefaultFront": 1,
    "Formation": 3
  },
  {
    "Id": "unit_b5d2-8681-6bba-f05b",
    "Name": "Neophyte Hybrids",
    "Type": "Unit",
    "Attributes": {
      "Keywords": "NEOPHYTE HYBRIDS, INFANTRY, GRENADES, GREAT DEVOURER, BATTLELINE",
      "Faction Keywords": "GENESTEALER CULTS"
    },
    "BasicProfileIds": [
      "profile_6b95-e90b-5833-634b",
      "profiles_1773327820976"
    ],
    "DefaultFront": 10,
    "Formation": 3
  },
  {
    "Id": "unit_55c7-90e0-419-44f9",
    "Name": "Nexos",
    "Type": "Unit",
    "Attributes": {
      "Keywords": "NEXOS, INFANTRY, CHARACTER, GREAT DEVOURER",
      "Faction Keywords": "GENESTEALER CULTS"
    },
    "BasicProfileIds": [
      "profile_13f2-3853-e18e-1bf8"
    ],
    "DefaultFront": 1,
    "Formation": 3
  },
  {
    "Id": "unit_2a91-a18e-bd08-fa66",
    "Name": "Patriarch",
    "Type": "Unit",
    "Attributes": {
      "Keywords": "PATRIARCH, INFANTRY, CHARACTER, PSYKER, GREAT DEVOURER",
      "Faction Keywords": "GENESTEALER CULTS"
    },
    "BasicProfileIds": [
      "profile_6fda-ef18-abe2-1d36"
    ],
    "DefaultFront": 1,
    "Formation": 3
  },
  {
    "Id": "unit_30e9-42fa-3a6e-e8ef",
    "Name": "Primus",
    "Type": "Unit",
    "Attributes": {
      "Keywords": "PRIMUS, INFANTRY, CHARACTER, GREAT DEVOURER",
      "Faction Keywords": "GENESTEALER CULTS"
    },
    "BasicProfileIds": [
      "profile_7c06-e833-529f-ef68"
    ],
    "DefaultFront": 1,
    "Formation": 3
  },
  {
    "Id": "unit_965b-496a-3a1b-22a8",
    "Name": "Purestrain Genestealers",
    "Type": "Unit",
    "Attributes": {
      "Keywords": "PURESTRAIN GENESTEALERS, INFANTRY, GREAT DEVOURER",
      "Faction Keywords": "GENESTEALER CULTS"
    },
    "BasicProfileIds": [
      "profile_11f4-40f5-e4de-2099"
    ],
    "DefaultFront": 5,
    "Formation": 3
  },
  {
    "Id": "unit_4565-bd65-9e8b-284d",
    "Name": "Reductus Saboteur",
    "Type": "Unit",
    "Attributes": {
      "Keywords": "REDUCTUS SABOTEUR, INFANTRY, CHARACTER, GRENADES, GREAT DEVOURER",
      "Faction Keywords": "GENESTEALER CULTS"
    },
    "BasicProfileIds": [
      "profile_2266-a20-1b5-2b7e"
    ],
    "DefaultFront": 1,
    "Formation": 3
  },
  {
    "Id": "unit_3d6c-357e-3c09-813c",
    "Name": "Sanctus",
    "Type": "Unit",
    "Attributes": {
      "Keywords": "SANCTUS, INFANTRY, CHARACTER, GREAT DEVOURER",
      "Faction Keywords": "GENESTEALER CULTS"
    },
    "BasicProfileIds": [
      "profile_6f45-994d-39f6-9592"
    ],
    "DefaultFront": 1,
    "Formation": 3
  },
  {
    "Id": "unit_908a-9fd8-2270-8dbd",
    "Name": "Benefictus",
    "Type": "Unit",
    "Attributes": {
      "Keywords": "CHARACTER, INFANTRY, PSYKER, GREAT DEVOURER, BENEFICTUS",
      "Faction Keywords": "GENESTEALER CULTS"
    },
    "BasicProfileIds": [
      "profile_13db-ced1-bc69-0cfb"
    ],
    "DefaultFront": 1,
    "Formation": 3
  }
]