[
  {
    "Id": "unit_81bd-ce4e-229f-a88",
    "Name": "Azrael",
    "Type": "Unit",
    "Attributes": {
      "Keywords": "CHARACTER, EPIC HERO, INFANTRY, IMPERIUM, TACTICUS, AZRAEL, DARK ANGELS, ADEPTUS ASTARTES, CHAPTER MASTER, DEATHWING, LEADER, EXPLOSIVES"
    },
    "BasicProfileIds": [
      "profile_dd33-8a4-6ff0-9572"
    ],
    "DefaultFront": 1,
    "Formation": 3
  },
  {
    "Id": "unit_bf62-244b-f9db-6cf",
    "Name": "Belial",
    "Type": "Unit",
    "Attributes": {
      "Keywords": "CHARACTER, EPIC HERO, INFANTRY, CAPTAIN, DARK ANGELS, ADEPTUS ASTARTES, IMPERIUM, BELIAL, TERMINATOR, DEATHWING, LEADER"
    },
    "BasicProfileIds": [
      "profile_7464-e8ef-58f4-8421"
    ],
    "DefaultFront": 1,
    "Formation": 3
  },
  {
    "Id": "unit_8f4b-c343-bef5-6779",
    "Name": "Sammael",
    "Type": "Unit",
    "Attributes": {
      "Keywords": "CHARACTER, EPIC HERO, MOUNTED, CAPTAIN, IMPERIUM, FLY, SAMMAEL, DARK ANGELS, ADEPTUS ASTARTES, RAVENWING, FRAME, LEADER, EXPLOSIVES"
    },
    "BasicProfileIds": [
      "profile_267d-3d21-56c5-9738"
    ],
    "DefaultFront": 1,
    "Formation": 3
  },
  {
    "Id": "unit_38c9-66a1-fe60-46af",
    "Name": "Ezekiel",
    "Type": "Unit",
    "Attributes": {
      "Keywords": "CHARACTER, EPIC HERO, INFANTRY, IMPERIUM, PSYKER, EZEKIEL, DARK ANGELS, ADEPTUS ASTARTES, LIBRARIAN, DEATHWING, LEADER, EXPLOSIVES, TACTICUS"
    },
    "BasicProfileIds": [
      "profile_fbc5-9529-2ab7-438c"
    ],
    "DefaultFront": 1,
    "Formation": 3
  },
  {
    "Id": "unit_9bf9-1e30-e4b4-939c",
    "Name": "Asmodai",
    "Type": "Unit",
    "Attributes": {
      "Keywords": "CHARACTER, EPIC HERO, INFANTRY, IMPERIUM, DARK ANGELS, ADEPTUS ASTARTES, ASMODAI, CHAPLAIN, TACTICUS, DEATHWING, LEADER, EXPLOSIVES"
    },
    "BasicProfileIds": [
      "profile_9cc2-8f0-aec2-5f87"
    ],
    "DefaultFront": 1,
    "Formation": 3
  },
  {
    "Id": "unit_15d3-ebc7-d28b-daf4",
    "Name": "Lion El'Jonson",
    "Type": "Unit",
    "Attributes": {
      "Keywords": "CHARACTER, EPIC HERO, MONSTER, IMPERIUM, DARK ANGELS, ADEPTUS ASTARTES, PRIMARCH, LION EL'JONSON, MOBILE"
    },
    "BasicProfileIds": [
      "profile_ecde-97eb-5e04-9b43"
    ],
    "DefaultFront": 1,
    "Formation": 3
  },
  {
    "Id": "unit_4b0d-45ff-fab3-7472",
    "Name": "Lazarus",
    "Type": "Unit",
    "Attributes": {
      "Keywords": "CHARACTER, EPIC HERO, INFANTRY, CAPTAIN, GRENADES, IMPERIUM, DARK ANGELS, ADEPTUS ASTARTES, LAZARUS, TACTICUS, DEATHWING, LEADER"
    },
    "BasicProfileIds": [
      "profile_6cfd-4749-b770-d730"
    ],
    "DefaultFront": 1,
    "Formation": 3
  },
  {
    "Id": "unit_4f36-6609-efac-baa6",
    "Name": "Nephilim Jetfighter",
    "Type": "Unit",
    "Attributes": {
      "Keywords": "VEHICLE, FLY, AIRCRAFT, IMPERIUM, NEPHILIM JETFIGHTER, ADEPTUS ASTARTES, DARK ANGELS, RAVENWING"
    },
    "BasicProfileIds": [
      "profile_523f-b6c1-31b1-2d68"
    ],
    "DefaultFront": 1,
    "Formation": 3
  },
  {
    "Id": "unit_9b3d-e812-4248-522",
    "Name": "Ravenwing Dark Talon",
    "Type": "Unit",
    "Attributes": {
      "Keywords": "IMPERIUM, FLY, VEHICLE, AIRCRAFT, DARK TALON, ADEPTUS ASTARTES, DARK ANGELS, RAVENWING"
    },
    "BasicProfileIds": [
      "profile_d259-e373-f7a2-3755"
    ],
    "DefaultFront": 1,
    "Formation": 3
  },
  {
    "Id": "unit_b4a0-d2fe-a988-f28b",
    "Name": "Land Speeder Vengeance",
    "Type": "Unit",
    "Attributes": {
      "Keywords": "FLY, IMPERIUM, VEHICLE, LAND SPEEDER VENGEANCE, ADEPTUS ASTARTES, DARK ANGELS, RAVENWING, FRAME"
    },
    "BasicProfileIds": [
      "profile_3d7a-dd85-b382-c4cb"
    ],
    "DefaultFront": 1,
    "Formation": 3
  },
  {
    "Id": "unit_152b-a271-df2b-21a9",
    "Name": "Ravenwing Darkshroud",
    "Type": "Unit",
    "Attributes": {
      "Keywords": "DARKSHROUD, IMPERIUM, FLY, VEHICLE, DARK ANGELS, ADEPTUS ASTARTES, RAVENWING, FRAME"
    },
    "BasicProfileIds": [
      "profile_e2ad-7d12-d9ea-d35e"
    ],
    "DefaultFront": 1,
    "Formation": 3
  },
  {
    "Id": "unit_212d-f302-aaaf-5c12",
    "Name": "Ravenwing Black Knights",
    "Type": "Unit",
    "Attributes": {
      "Keywords": "MOUNTED, GRENADES, IMPERIUM, DARK ANGELS, ADEPTUS ASTARTES, RAVENWING BLACK KNIGHTS, RAVENWING"
    },
    "BasicProfileIds": [
      "profile_3447-e35d-eb8-c856",
      "profiles_1771626569680"
    ],
    "DefaultFront": 3,
    "Formation": 3
  },
  {
    "Id": "unit_e87d-f173-88b9-aa84",
    "Name": "Ravenwing Command Squad",
    "Type": "Unit",
    "Attributes": {
      "Keywords": "MOUNTED, IMPERIUM, RAVENWING COMMAND SQUAD, DARK ANGELS, ADEPTUS ASTARTES, RAVENWING, SUPPORT, EXPLOSIVES"
    },
    "BasicProfileIds": [
      "profiles_1771623185722",
      "profiles_1771623017988",
      "profile_f80c-d861-9c-8899"
    ],
    "DefaultFront": 3,
    "Formation": 3
  },
  {
    "Id": "unit_a6cc-9a65-dbf1-71b0",
    "Name": "Deathwing Knights",
    "Type": "Unit",
    "Attributes": {
      "Keywords": "INFANTRY, IMPERIUM, DARK ANGELS, ADEPTUS ASTARTES, DEATHWING KNIGHTS, TERMINATOR, DEATHWING"
    },
    "BasicProfileIds": [
      "profile_5e70-a1d4-9f2f-2414",
      "profile_d332-e963-4e2e-35df"
    ],
    "DefaultFront": 5,
    "Formation": 3
  },
  {
    "Id": "unit_6135-d842-8e61-889d",
    "Name": "Deathwing Terminator Squad",
    "Type": "Unit",
    "Attributes": {
      "Keywords": "INFANTRY, IMPERIUM, DEATHWING TERMINATOR SQUAD, DARK ANGELS, ADEPTUS ASTARTES, TERMINATOR, DEATHWING"
    },
    "BasicProfileIds": [
      "profile_960d-3443-a603-e0",
      "profiles_1771625528802"
    ],
    "DefaultFront": 1,
    "Formation": 3
  },
  {
    "Id": "unit_f34-e2f9-c98e-1916",
    "Name": "Inner Circle Companions",
    "Type": "Unit",
    "Attributes": {
      "Keywords": "INFANTRY, IMPERIUM, DARK ANGELS, TACTICUS, ADEPTUS ASTARTES, DEATHWING, INNER CIRCLE COMPANIONS"
    },
    "BasicProfileIds": [
      "profile_8c40-80cc-bf40-ca6d"
    ],
    "DefaultFront": 3,
    "Formation": 3
  }
]
