[
  {
    "Id": "unit_1762508387337",
    "Name": "Sir Hekhtur",
    "Type": "Unit",
    "Attributes": {
      "Keywords": "INFANTRY, CHARACTER, EPIC HERO, IMPERIUM, Sir Hekhtur"
    },
    "BasicProfileIds": [
      "profile_1762508334855"
    ],
    "DefaultFront": 1,
    "Formation": 3
  },
  {
    "Id": "unit_1762431957169",
    "Name": "Knight Defender",
    "Type": "Unit",
    "Attributes": {
      "Keywords": "VEHICLE, WALKER, TITANIC, TOWERING, QUESTORIS, CHARACTER, IMPERIUM, KNIGHT DEFENDER"
    },
    "BasicProfileIds": [
      "profile_1762505151603"
    ],
    "DefaultFront": 1,
    "Formation": 3
  },
  {
    "Id": "unit_55fb-9c91-1a4f-3037",
    "Name": "Canis Rex",
    "Type": "Unit",
    "Attributes": {
      "Keywords": "EPIC HERO, CHARACTER, IMPERIUM",
      "Faction Keywords": "IMPERIAL KNIGHTS"
    },
    "BasicProfileIds": [
      "profile_55d8-cfb6-d9f-48a0",
      "profile_1762508334855"
    ],
    "DefaultFront": 2,
    "Formation": 3
  },
  {
    "Id": "unit_5bbd-c5d3-58d7-e391",
    "Name": "Armiger Warglaive",
    "Type": "Unit",
    "Attributes": {
      "Keywords": "VEHICLE, WALKER, BATTLELINE, IMPERIUM, WARGLAIVE, ARMIGER",
      "Faction Keywords": "IMPERIAL KNIGHTS"
    },
    "BasicProfileIds": [
      "profile_1459-b06d-639b-e171"
    ],
    "DefaultFront": 1,
    "Formation": 3
  },
  {
    "Id": "unit_7314-3c4a-36ab-a594",
    "Name": "Armiger Helverin",
    "Type": "Unit",
    "Attributes": {
      "Keywords": "VEHICLE, WALKER, BATTLELINE, IMPERIUM, HELVERIN, ARMIGER",
      "Faction Keywords": "IMPERIAL KNIGHTS"
    },
    "BasicProfileIds": [
      "profile_a7e1-39bc-7da4-5e7c"
    ],
    "DefaultFront": 1,
    "Formation": 3
  },
  {
    "Id": "unit_8441-8356-5e7c-69ee",
    "Name": "Knight Paladin",
    "Type": "Unit",
    "Attributes": {
      "Keywords": "VEHICLE, WALKER, TITANIC, TOWERING, CHARACTER, IMPERIUM, KNIGHT PALADIN, QUESTORIS",
      "Faction Keywords": "IMPERIAL KNIGHTS"
    },
    "BasicProfileIds": [
      "profile_c895-8913-fee7-678e"
    ],
    "DefaultFront": 1,
    "Formation": 3
  },
  {
    "Id": "unit_9efd-ec72-353f-4b23",
    "Name": "Knight Errant",
    "Type": "Unit",
    "Attributes": {
      "Keywords": "VEHICLE, WALKER, TITANIC, TOWERING, CHARACTER, IMPERIUM, KNIGHT ERRANT, QUESTORIS",
      "Faction Keywords": "IMPERIAL KNIGHTS"
    },
    "BasicProfileIds": [
      "profile_9730-cfa8-fbcf-5aa9"
    ],
    "DefaultFront": 1,
    "Formation": 3
  },
  {
    "Id": "unit_eb4-4a67-11e9-3cb8",
    "Name": "Knight Gallant",
    "Type": "Unit",
    "Attributes": {
      "Keywords": "VEHICLE, WALKER, TITANIC, TOWERING, CHARACTER, IMPERIUM, KNIGHT GALLANT, QUESTORIS",
      "Faction Keywords": "IMPERIAL KNIGHTS"
    },
    "BasicProfileIds": [
      "profile_cb8f-96dc-a97e-c852"
    ],
    "DefaultFront": 1,
    "Formation": 3
  },
  {
    "Id": "unit_c609-c87e-f9dd-5006",
    "Name": "Knight Warden",
    "Type": "Unit",
    "Attributes": {
      "Keywords": "VEHICLE, WALKER, TITANIC, TOWERING, CHARACTER, IMPERIUM, KNIGHT WARDEN, QUESTORIS",
      "Faction Keywords": "IMPERIAL KNIGHTS"
    },
    "BasicProfileIds": [
      "profile_4770-d5eb-3d0d-6d49"
    ],
    "DefaultFront": 1,
    "Formation": 3
  },
  {
    "Id": "unit_1e27-a6de-3840-a050",
    "Name": "Knight Crusader",
    "Type": "Unit",
    "Attributes": {
      "Keywords": "VEHICLE, WALKER, TITANIC, TOWERING, CHARACTER, IMPERIUM, KNIGHT CRUSADER, QUESTORIS",
      "Faction Keywords": "IMPERIAL KNIGHTS"
    },
    "BasicProfileIds": [
      "profile_e9ca-1260-3fd4-beb6"
    ],
    "DefaultFront": 1,
    "Formation": 3
  },
  {
    "Id": "unit_ebd9-7175-3f0c-72a9",
    "Name": "Knight Preceptor",
    "Type": "Unit",
    "Attributes": {
      "Keywords": "VEHICLE, WALKER, TITANIC, TOWERING, CHARACTER, IMPERIUM, KNIGHT PRECEPTOR, QUESTORIS",
      "Faction Keywords": "IMPERIAL KNIGHTS"
    },
    "BasicProfileIds": [
      "profile_cea2-2ace-efda-f52d"
    ],
    "DefaultFront": 1,
    "Formation": 3
  },
  {
    "Id": "unit_6e36-f85-1c3b-8bf3",
    "Name": "Knight Castellan",
    "Type": "Unit",
    "Attributes": {
      "Keywords": "VEHICLE, WALKER, TITANIC, TOWERING, CHARACTER, IMPERIUM, KNIGHT CASTELLAN, DOMINUS",
      "Faction Keywords": "IMPERIAL KNIGHTS"
    },
    "BasicProfileIds": [
      "profile_6715-86ee-6799-89a2"
    ],
    "DefaultFront": 1,
    "Formation": 3
  },
  {
    "Id": "unit_8fb9-50b2-adc6-161a",
    "Name": "Knight Valiant",
    "Type": "Unit",
    "Attributes": {
      "Keywords": "VEHICLE, WALKER, TITANIC, TOWERING, CHARACTER, IMPERIUM, KNIGHT VALIANT, DOMINUS",
      "Faction Keywords": "IMPERIAL KNIGHTS"
    },
    "BasicProfileIds": [
      "profile_482a-8ce4-8a22-c621"
    ],
    "DefaultFront": 1,
    "Formation": 3
  },
  {
    "Id": "unit_f8d0-fdf2-2e5e-3b74",
    "Name": "Acastus Knight Asterius",
    "Type": "Unit",
    "Attributes": {
      "Keywords": "VEHICLE, WALKER, TITANIC, TOWERING, IMPERIUM, KNIGHT ASTERIUS, ACASTUS",
      "Faction Keywords": "IMPERIAL KNIGHTS"
    },
    "BasicProfileIds": [
      "profile_68a2-c0af-9c9e-24"
    ],
    "DefaultFront": 1,
    "Formation": 3
  },
  {
    "Id": "unit_61c9-8baf-22b4-5d84",
    "Name": "Acastus Knight Porphyrion",
    "Type": "Unit",
    "Attributes": {
      "Keywords": "VEHICLE, WALKER, TITANIC, TOWERING, IMPERIUM, ACASTUS, KNIGHT PORPHYRION",
      "Faction Keywords": "IMPERIAL KNIGHTS"
    },
    "BasicProfileIds": [
      "profile_e6ec-843a-ab40-28a"
    ],
    "DefaultFront": 1,
    "Formation": 3
  },
  {
    "Id": "unit_9ee-e289-bc6c-d943",
    "Name": "Cerastus Knight Lancer",
    "Type": "Unit",
    "Attributes": {
      "Keywords": "CHARACTER, VEHICLE, WALKER, TITANIC, TOWERING, IMPERIUM, KNIGHT LANCER, CERASTUS",
      "Faction Keywords": "IMPERIAL KNIGHTS"
    },
    "BasicProfileIds": [
      "profile_7c8d-6043-5b0-73e2"
    ],
    "DefaultFront": 1,
    "Formation": 3
  },
  {
    "Id": "unit_1654-5c17-474e-2d84",
    "Name": "Cerastus Knight Castigator",
    "Type": "Unit",
    "Attributes": {
      "Keywords": "CHARACTER, VEHICLE, WALKER, TITANIC, TOWERING, IMPERIUM, CERASTUS, KNIGHT CASTIGATOR",
      "Faction Keywords": "IMPERIAL KNIGHTS"
    },
    "BasicProfileIds": [
      "profile_139a-660e-cadf-471c"
    ],
    "DefaultFront": 1,
    "Formation": 3
  },
  {
    "Id": "unit_11d3-167b-6dff-a4c2",
    "Name": "Cerastus Knight Acheron",
    "Type": "Unit",
    "Attributes": {
      "Keywords": "CHARACTER, VEHICLE, WALKER, TITANIC, TOWERING, IMPERIUM, CERASTUS, KNIGHT ACHERON",
      "Faction Keywords": "IMPERIAL KNIGHTS"
    },
    "BasicProfileIds": [
      "profile_791d-8b09-266f-8f61"
    ],
    "DefaultFront": 1,
    "Formation": 3
  },
  {
    "Id": "unit_37a7-d156-1e4c-8fe1",
    "Name": "Cerastus Knight Atrapos",
    "Type": "Unit",
    "Attributes": {
      "Keywords": "CHARACTER, VEHICLE, WALKER, TITANIC, TOWERING, IMPERIUM, CERASTUS, KNIGHT ATRAPOS",
      "Faction Keywords": "IMPERIAL KNIGHTS"
    },
    "BasicProfileIds": [
      "profile_c436-5110-1b57-4c43"
    ],
    "DefaultFront": 1,
    "Formation": 3
  },
  {
    "Id": "unit_adfa-19fc-7337-7350",
    "Name": "Questoris Knight Magaera",
    "Type": "Unit",
    "Attributes": {
      "Keywords": "CHARACTER, VEHICLE, WALKER, TITANIC, TOWERING, IMPERIUM, QUESTORIS, KNIGHT MAGAERA",
      "Faction Keywords": "IMPERIAL KNIGHTS"
    },
    "BasicProfileIds": [
      "profile_3148-a4a3-ecb-b23f"
    ],
    "DefaultFront": 1,
    "Formation": 3
  },
  {
    "Id": "unit_f8f3-a438-1212-93e8",
    "Name": "Questoris Knight Styrix",
    "Type": "Unit",
    "Attributes": {
      "Keywords": "CHARACTER, VEHICLE, WALKER, TITANIC, TOWERING, IMPERIUM, QUESTORIS, KNIGHT STYRIX",
      "Faction Keywords": "IMPERIAL KNIGHTS"
    },
    "BasicProfileIds": [
      "profile_b556-4e8-b576-9191"
    ],
    "DefaultFront": 1,
    "Formation": 3
  },
  {
    "Id": "unit_e3dd-7e90-140a-b3ab",
    "Name": "Armiger Moirax",
    "Type": "Unit",
    "Attributes": {
      "Keywords": "BATTLELINE, VEHICLE, WALKER, IMPERIUM, ARMIGER, MOIRAX",
      "Faction Keywords": "IMPERIAL KNIGHTS"
    },
    "BasicProfileIds": [
      "profile_3bc2-f11c-17f4-befe"
    ],
    "DefaultFront": 1,
    "Formation": 3
  },
  {
    "Id": "units_1775465258652",
    "Name": "Knight Destrier",
    "Type": "Unit",
    "DefaultFront": 1,
    "Formation": 3,
    "BasicProfileIds": [
      "profiles_1775465244212"
    ],
    "Attributes": {
      "KEYWORDS": "VEHICLE,, WALKER, TITANIC, TOWERING, BELLATUS, CHARACTER, IMPERIUM, KNIGHT DESTRIER",
      "FACTION KEYWORDS": "IMPERIAL KNIGHT"
    }
  }
]