[
  {
    "Id": "6866ef0af0f4ee4feb035535",
    "Name": "Miao Ying, The Storm Dragon",
    "Type": "Unit",
    "Attributes": {
      "type": "Heavy Infantry"
    },
    "BasicProfileIds": [
      "6866ef0af0f4ee4feb03553e"
    ],
    "DefaultFront": 1,
    "Formation": 0
  },
  {
    "Id": "6866ef0af0f4ee4feb035535_miao_ying,_human_form",
    "Name": "Miao Ying, The Storm Dragon - Miao Ying, Human Form",
    "Type": "Unit",
    "BasicProfileIds": [
      "6866ef0af0f4ee4feb03553e"
    ],
    "DefaultFront": 1,
    "Formation": 0
  },
  {
    "Id": "6866ef0af0f4ee4feb035535_miao_ying,_dragon_form",
    "Name": "Miao Ying, The Storm Dragon - Miao Ying, Dragon Form",
    "Type": "Unit",
    "BasicProfileIds": [
      "6866ef0af0f4ee4feb03553f"
    ],
    "DefaultFront": 1,
    "Formation": 0
  },
  {
    "Id": "6866ef0bf0f4ee4feb035736",
    "Name": "Gate Keeper",
    "Type": "Unit",
    "Attributes": {
      "type": "Heavy Infantry"
    },
    "BasicProfileIds": [
      "6866ef0bf0f4ee4feb035739"
    ],
    "DefaultFront": 1,
    "Formation": 0
  },
  {
    "Id": "6866ef0bf0f4ee4feb035736_cathayan_warhorse",
    "Name": "Gate Keeper on Cathayan Warhorse",
    "Type": "Unit",
    "Attributes": {
      "type": "Heavy Cavalry"
    },
    "BasicProfileIds": [
      "73621bc6-49c7-4ef6-b1f9-b1ca5762fa59"
    ],
    "DefaultFront": 1,
    "Formation": 0
  },
  {
    "Id": "6866ef0bf0f4ee4feb036c07",
    "Name": "Gate Master",
    "Type": "Unit",
    "Attributes": {
      "type": "Heavy Infantry"
    },
    "BasicProfileIds": [
      "6866ef0bf0f4ee4feb036c0a"
    ],
    "DefaultFront": 1,
    "Formation": 0
  },
  {
    "Id": "6866ef0bf0f4ee4feb036c07_cathayan_warhorse",
    "Name": "Gate Master on Cathayan Warhorse",
    "Type": "Unit",
    "Attributes": {
      "type": "Heavy Cavalry"
    },
    "BasicProfileIds": [
      "9e976c64-4500-44f6-9e6c-0e76a12bb488"
    ],
    "DefaultFront": 1,
    "Formation": 0
  },
  {
    "Id": "6866ef0bf0f4ee4feb037d56",
    "Name": "Lord Magistrate",
    "Type": "Unit",
    "Attributes": {
      "type": "Regular Infantry"
    },
    "BasicProfileIds": [
      "6866ef0bf0f4ee4feb037d5e"
    ],
    "DefaultFront": 1,
    "Formation": 0
  },
  {
    "Id": "6866ef0bf0f4ee4feb037d56_sky_lantern",
    "Name": "Lord Magistrate on Sky Lantern",
    "Type": "Unit",
    "Attributes": {
      "type": "Heavy Chariot"
    },
    "BasicProfileIds": [
      "d5dc961f-65f5-4652-a6ad-df6eae6fe27e"
    ],
    "DefaultFront": 1,
    "Formation": 0
  },
  {
    "Id": "6866ef0cf0f4ee4feb039e62",
    "Name": "Shugengan General",
    "Type": "Unit",
    "Attributes": {
      "type": "Monstrous Creature"
    },
    "BasicProfileIds": [
      "6866ef0cf0f4ee4feb039e65"
    ],
    "DefaultFront": 1,
    "Formation": 0
  },
  {
    "Id": "6866ef0cf0f4ee4feb03a87f",
    "Name": "Shugengan Lord",
    "Type": "Unit",
    "Attributes": {
      "type": "Monstrous Creature"
    },
    "BasicProfileIds": [
      "6866ef0cf0f4ee4feb03a887"
    ],
    "DefaultFront": 1,
    "Formation": 0
  },
  {
    "Id": "6866ef0df0f4ee4feb03b2a4",
    "Name": "Strategist",
    "Type": "Unit",
    "Attributes": {
      "type": "Regular Infantry"
    },
    "BasicProfileIds": [
      "6866ef0df0f4ee4feb03b2a7"
    ],
    "DefaultFront": 1,
    "Formation": 0
  },
  {
    "Id": "6866ef0df0f4ee4feb03b2a4_sky_lantern",
    "Name": "Strategist on Sky Lantern",
    "Type": "Unit",
    "Attributes": {
      "type": "Heavy Chariot"
    },
    "BasicProfileIds": [
      "cce541a3-9b7f-4748-af0a-7d0c71d28c97"
    ],
    "DefaultFront": 1,
    "Formation": 0
  },
  {
    "Id": "6866ef0df0f4ee4feb03d3a1",
    "Name": "Jade Lancer",
    "Type": "Unit",
    "Attributes": {
      "type": "Heavy Cavalry"
    },
    "BasicProfileIds": [
      "6866ef0df0f4ee4feb03d3ae"
    ],
    "DefaultFront": 5,
    "Formation": 0
  },
  {
    "Id": "6866ef0ef0f4ee4feb042789",
    "Name": "Cathayan Grand Cannon",
    "Type": "Unit",
    "Attributes": {
      "type": "War Machine"
    },
    "BasicProfileIds": [
      "6866ef0ef0f4ee4feb042792"
    ],
    "DefaultFront": 1,
    "Formation": 0
  },
  {
    "Id": "6866ef0ff0f4ee4feb04297a",
    "Name": "Cathayan Sentinel",
    "Type": "Unit",
    "BasicProfileIds": [
      "6866ef0ff0f4ee4feb042982"
    ],
    "DefaultFront": 1,
    "Formation": 0
  },
  {
    "Id": "6866ef0ff0f4ee4feb042b69",
    "Name": "Fire Rain Rocket Battery",
    "Type": "Unit",
    "Attributes": {
      "type": "War Machine"
    },
    "BasicProfileIds": [
      "6866ef0ff0f4ee4feb042b72"
    ],
    "DefaultFront": 1,
    "Formation": 0
  },
  {
    "Id": "6866ef10f0f4ee4feb045778",
    "Name": "Sky Lantern",
    "Type": "Unit",
    "Attributes": {
      "type": "Heavy Chariot"
    },
    "BasicProfileIds": [
      "6866ef10f0f4ee4feb045780"
    ],
    "DefaultFront": 1,
    "Formation": 0
  },
  {
    "Id": "6866ef10f0f4ee4feb045d6b",
    "Name": "Sky Lantern",
    "Type": "Unit",
    "Attributes": {
      "type": "Heavy Chariot"
    },
    "BasicProfileIds": [
      "6866ef10f0f4ee4feb045d6e"
    ],
    "DefaultFront": 1,
    "Formation": 0
  },
  {
    "Id": "6866ef12f0f4ee4feb047496",
    "Name": "Doomseeker",
    "Type": "Unit",
    "Attributes": {
      "type": "Heavy Infantry"
    },
    "BasicProfileIds": [
      "6866ef12f0f4ee4feb04749c"
    ],
    "DefaultFront": 1,
    "Formation": 0
  },
  {
    "Id": "units_1779470139900",
    "Name": "Crane Gunner Teams",
    "Type": "Unit",
    "DefaultFront": 3,
    "Formation": 0,
    "BasicProfileIds": [
      "profiles_1779469387502"
    ],
    "Attributes": {
      "type": "Regular Infantry"
    }
  },
  {
    "Id": "units_1779471148992",
    "Name": "Iron Hail Gunners",
    "Type": "Unit",
    "DefaultFront": 4,
    "Formation": 0,
    "BasicProfileIds": [
      "profiles_1779470995781"
    ],
    "Attributes": {
      "type": "Regular Infantry"
    }
  },
  {
    "Id": "units_1779472907533",
    "Name": "Peasant Levy",
    "Type": "Unit",
    "DefaultFront": 10,
    "Formation": 0,
    "BasicProfileIds": [
      "profiles_1779472161165"
    ],
    "Attributes": {
      "type": "Regular Infantry"
    }
  },
  {
    "Id": "units_1779483303323",
    "Name": "Supreme Astromancer",
    "Type": "Unit",
    "DefaultFront": 1,
    "Formation": 0,
    "BasicProfileIds": [
      "profiles_1779483163199"
    ]
  },
  {
    "Id": "units_1779484202273",
    "Name": "Supreme Astromancer on Cathayan Horse",
    "Type": "Unit",
    "DefaultFront": 1,
    "Formation": 0,
    "BasicProfileIds": [
      "profiles_1779483163200"
    ],
    "Attributes": {
      "type": "Heavy Cavalry"
    }
  }
]