[
  {
    "Id": "unit_eecd-6976-6410-1e42",
    "Name": "Darnath Lysander",
    "Type": "Unit",
    "Attributes": {
      "Keywords": "EPIC HERO, CHARACTER, INFANTRY, CAPTAIN, IMPERIUM, TERMINATOR, ADEPTUS ASTARTES, IMPERIAL FISTS, DARNATH LYSANDER, LEADER"
    },
    "BasicProfileIds": [
      "profile_6d34-cff2-ff30-d3cc"
    ],
    "DefaultFront": 1,
    "Formation": 3
  },
  {
    "Id": "unit_5936-83d6-4e30-915c",
    "Name": "Tor Garadon",
    "Type": "Unit",
    "Attributes": {
      "Keywords": "EPIC HERO, CHARACTER, INFANTRY, CAPTAIN, GRAVIS, TOR GARADON, ADEPTUS ASTARTES, IMPERIUM, IMPERIAL FISTS, LEADER"
    },
    "BasicProfileIds": [
      "profile_7c25-2fc1-6ba6-160d"
    ],
    "DefaultFront": 1,
    "Formation": 3
  },
  {
    "Id": "unit_59e3-5a97-f36d-5b94",
    "Name": "Pedro Kantor",
    "Type": "Unit",
    "Attributes": {
      "Keywords": "EPIC HERO, CHARACTER, INFANTRY, GRENADES, IMPERIUM, CHAPTER MASTER, ADEPTUS ASTARTES, IMPERIAL FISTS, PEDRO KANTOR, LEADER"
    },
    "BasicProfileIds": [
      "profile_f0d0-41c3-13ce-6595"
    ],
    "DefaultFront": 1,
    "Formation": 3
  }
]
